{
  "schema_version": 1,
  "platform": "demo",
  "profile_version": "2026-09-29",
  "verified_on": "2026-09-29",
  "sources": [
    {
      "title": "Synthetic demo profile",
      "reference": "Written for this bundle. The profile is synthetic and serves the fixtures only; it describes no real platform.",
      "retrieved_on": "2026-09-29"
    }
  ],
  "search": {
    "per_query_result_cap": 1000,
    "max_query_length": 300,
    "grammar": {
      "and": "AND",
      "or": "OR",
      "not": "NOT",
      "quote": "\"",
      "group_open": "(",
      "group_close": ")",
      "forbidden_characters": [
        "\"",
        "(",
        ")",
        "\u201c",
        "\u201d"
      ],
      "reserved_words": [
        "AND",
        "OR",
        "NOT"
      ]
    },
    "url": {
      "base": "https://demo.example/search/people/",
      "keywords_param": "keywords",
      "fixed_params": [],
      "filter_value_encoding": "json_string_array",
      "max_length": 2000
    }
  },
  "filters": {
    "geo": {
      "filter_id": "geo",
      "values": null
    },
    "company_size": {
      "filter_id": "company_size",
      "values": [
        "1-10",
        "11-50",
        "51-200",
        "201-500",
        "501-1000",
        "1001-5000",
        "5001-10000",
        "10001+"
      ]
    }
  },
  "partition_order": [
    "geo",
    "company_size"
  ],
  "pacing": {
    "per_run_max_queries": 7,
    "per_day_max_rows": 1000
  },
  "export_columns": {
    "profile_url": "profileUrl",
    "title": "title",
    "source_query": "query",
    "company": "company",
    "location": "location"
  },
  "profile_key": {
    "host_suffixes": [
      "demo.example"
    ],
    "path_prefix": "/in/"
  }
}
